key,en,nl
solid_snejk_intro_1,Oh no! The fences in our park got blown away!,Oh nee! De hekken van ons park zijn weggeblazen!
solid_snejk_intro_2,Let us find the fences and fix the park so we can play football again!,Laten we de hekken vinden en het park herstellen zodat we terug voetbal kunnen spelen!
solid_snejk_main_1,"Hey, let's fix the park together!","Hey, laten we het park samen herstellen!"
solid_snejk_main_2,You bring me parts of the fence and I'll set it up.,Jij brengt mij stukken van het hek en ik zal ze opzetten.
solid_snejk_main_3,They must be around here somewhere...,Ze moeten hier ergens in buurt zijn...
